ID,Title,Created At,Closed At
7587,BUG: shared log axes lose _minpos and revert to default,2016-12-08T01:28:28Z,2016-12-13T03:24:40Z
7406,NaN causes plt.vlines to not scale y limits,2016-11-04T18:38:56Z,2016-11-08T20:21:33Z
7373,Regression in imshow,2016-11-01T16:57:13Z,2016-11-07T20:46:24Z
7114,BUG: ax.tick_params change in tick length does not adjust tick labels,2016-09-14T22:59:58Z,2016-09-16T05:17:04Z
6967,symlog + minor ticks = exception,2016-08-23T19:09:30Z,
6940,large memory leak in new contour routine,2016-08-12T02:42:43Z,2016-08-29T20:03:40Z
6776,Fix #6773: Don't do image extent adjustment...,2016-07-17T14:38:01Z,2016-11-21T21:27:35Z
6516,savefig to pdf: 'str' object has no attribute 'decode',2016-05-31T20:48:11Z,
6509,pylab image_masked is broken,2016-05-31T07:36:50Z,2016-07-10T01:05:23Z
6420,matplotlib Qt5Agg backend error: 'figure' is an unknown keyword argument,2016-05-13T21:44:51Z,
6313,weighted_wiggle stackplot fails when all lines are zero at same x,2016-04-18T11:32:08Z,
6276,Ticklabel format not preserved after editing plot limits,2016-04-06T22:06:50Z,2016-05-16T20:59:50Z
6270,pyplot.contour() not working with matplotlib.ticker.LinearLocator(),2016-04-05T22:32:38Z,2016-05-16T13:47:15Z
6266,Better fallback when color is a float,2016-04-03T07:36:52Z,2016-04-08T18:09:08Z
6228,Rasterizing patch changes filling of hatches in pdf backend,2016-03-26T12:46:52Z,2016-11-14T21:51:40Z
6227,Rasterizing patch in legend changes position - PDF backend,2016-03-26T12:37:53Z,
6226,Issue saving figure as eps when using gouraud shaded triangulation,2016-03-25T20:53:44Z,2016-04-30T04:47:53Z
6212,ENH? BUG? `pyplot.setp`/`Artist.setp` does not accept non-indexable iterables of handles.,2016-03-23T15:47:42Z,2016-03-26T03:56:33Z
6173,"`linestyle` parameter does not support default cycler through `None`, crashes instead.",2016-03-17T17:11:13Z,2016-05-16T20:59:50Z
6125,Tight_layout failing on second png output with gtk backend,2016-03-07T11:42:04Z,
6035,Issue(?): head size of FancyArrowPatch changes between interactive figure and picture export,2016-02-20T13:49:15Z,2016-05-30T20:34:14Z
6000,Non-working 'set_visible' method for PatchCollection,2016-02-14T18:38:19Z,
5963,Unnecessarily large date range created when plotting a single point using a Datetime object,2016-02-03T17:12:56Z,
5948,tilted line visible in generated pdf file,2016-01-30T22:16:34Z,2016-02-22T20:31:27Z
5841,extra label for non-existent tick,2016-01-13T05:59:15Z,2016-02-08T23:57:45Z
5830,Incorrect overlap of markers in scatter3D,2016-01-11T07:20:40Z,
5692,Can't remove StemContainer,2015-12-17T19:04:56Z,2015-12-23T16:15:42Z
5609,Segfaults with wxpython 3.0.2.0 backend,2015-12-03T13:41:00Z,
5477,Contouring decreasing levels,2015-11-13T11:13:11Z,
5464,figaspect not working with numpy floats,2015-11-11T19:26:15Z,2015-11-18T05:14:00Z
5456,'bottom cannot be >= top' when using `tight_layout`,2015-11-10T09:43:09Z,
5444,\overline and subscripts/superscripts in mathtext,2015-11-08T22:32:06Z,2015-11-09T12:46:49Z
5424,Update colorbar after changing mappable.norm,2015-11-06T21:34:51Z,
5377,Plotting three points using scatter results in wrong color - 1.4.3,2015-11-02T06:31:01Z,
5344,Arrow in polar plot broken,2015-10-29T01:05:23Z,
5238,the offset of the scientific notation in xaxis stays at bottom when axis is set to top,2015-10-13T16:56:42Z,
5105,1.5rc1: Calling figure transform with wrong argument crashs python,2015-09-19T16:19:38Z,2015-10-02T21:15:07Z
5023,Fix Agg clipping,2015-09-04T00:36:49Z,2015-09-04T05:00:24Z
5016,plot line not shown in some cases involving masked arrays,2015-09-01T18:13:18Z,2015-09-06T18:22:08Z
5004,Alpha blending is incorrect in OffsetImage,2015-08-28T11:45:16Z,
4996,tick labels when autoscale is off,2015-08-27T07:07:01Z,
4976,missing imshow() subplots when using tight_layout(),2015-08-21T18:38:28Z,
4947,animation blitting is no longer working,2015-08-17T23:02:18Z,2015-08-18T13:16:12Z
4917,UserWarning for pandas dataframe plot with errors,2015-08-13T21:05:14Z,
4786,figure.add_subplot not creating new axes after change_geometry(),2015-07-25T01:03:24Z,
4784,Incorrect polygon filling of mplot3d filled contouring,2015-07-24T15:26:02Z,2015-07-27T20:33:28Z
4751,Bar plot seems not to understand numpy.uint8 dtype,2015-07-21T18:43:21Z,2015-07-22T14:53:50Z
4602,bar / hist : gap between first bar and other bars with lw=0.0,2015-07-08T11:29:00Z,2016-09-06T00:52:01Z
4584,ColorbarBase draws edges in slightly wrong positions. ,2015-07-04T22:51:16Z,
4581,race condition in log scale + locating minor ticks,2015-07-03T23:14:30Z,
4513,Cursor does not work with useblit=False under PySide,2015-06-10T15:58:26Z,
4470,Issue encoding type1 fonts with python 3,2015-05-25T21:41:11Z,2015-07-03T15:18:21Z
4450,shared axes switch to log scale,2015-05-21T03:25:24Z,
4448,segfault creating polarplot with GridHelperCurveLinear,2015-05-20T15:20:05Z,
4447,Qt figure options widget can't undo step linestyle,2015-05-20T12:25:45Z,2015-07-08T01:30:41Z
4445,Two issues with the axes offset indicator,2015-05-19T20:25:26Z,2016-03-26T02:52:54Z
4437,tricontour and tricontourf hang,2015-05-17T16:27:18Z,2015-07-16T02:40:58Z
4421,IPython Notebook: irregular marker edge for 'o',2015-05-12T19:22:05Z,2015-05-13T17:56:24Z
4413,Long axis title alters xaxis length and direction with `plt.tight_layout()`,2015-05-07T14:02:03Z,
4354,scatter not showing valid x/y points with invalid color,2015-04-19T11:28:39Z,
4346,Tick label padding on first y-axis changes when adding a second y-axis,2015-04-17T05:17:11Z,
4323,"seaborn.tsplot and matplotlib's ""Curve lines and axes parameters"" editor",2015-04-10T16:00:46Z,2015-05-13T17:59:04Z
4321,clabel ticks and axes limits with eps zoom output ,2015-04-10T05:45:34Z,
4318,pyplot.savefig fails with ValueError: cannot convert float NaN to integer,2015-04-07T23:49:29Z,2015-07-17T00:35:51Z
4309,Bbox overlaps method returns True for NaN vertices ,2015-04-03T20:38:50Z,2015-04-19T17:04:16Z
4303,Labels become colors in figure options in qt backends,2015-04-01T13:28:32Z,2015-04-03T17:45:28Z
4283,Memory hole when using Cursor widget with Qt (PySide) and useblit=True on Windows,2015-03-26T19:45:43Z,2015-06-10T15:59:49Z
4280,imsave reduces 1row from the image,2015-03-26T11:37:00Z,2016-02-18T02:36:03Z
4262,Bug in pyplot.plot() with zorder/solid_capstyle kwarg combinations,2015-03-22T17:45:03Z,2015-03-23T03:16:08Z
4239,Errorbar caps missing in master when saving to PDF,2015-03-18T07:00:06Z,2015-03-18T18:05:40Z
4227,pcolorfast fails in master when image is not uniform,2015-03-16T04:01:07Z,2015-04-19T19:49:56Z
4212,Hist showing wrong first bin,2015-03-11T23:15:02Z,2016-09-06T00:55:03Z
4185,Colorbar outline has broken path in vector backends,2015-03-03T20:29:35Z,2015-03-04T22:48:51Z
4180,UniformTriRefiner gives uncorrect results for transposed arrays,2015-03-02T02:53:55Z,2015-03-04T02:06:55Z
4162,c=color not changing line color,2015-02-25T14:08:58Z,2015-03-08T01:08:46Z
4131,pyplot.yticks after pyplot.ylim breaks the scale,2015-02-19T05:56:22Z,
4083,Marker edges are randomly missing,2015-02-08T15:03:50Z,2015-02-19T02:42:06Z
4076,"contains() is broken with scatter plots with master, works with v1.4.3rc1",2015-02-07T17:53:09Z,2015-02-11T17:01:56Z
4053,PowerNorm().__call__ doesn't work with scalar input value,2015-01-29T23:28:43Z,2015-02-02T02:34:33Z
4050,Fix masked array handling,2015-01-29T17:19:38Z,2015-01-30T23:18:44Z
4049,Issue with plotting zeros in log space,2015-01-29T15:15:09Z,2015-01-30T23:18:44Z
4043,tick_right() doesn't move scale factor,2015-01-28T00:20:37Z,2015-02-16T03:12:19Z
4033,PatchCollection with one patch disappears when zooming in too much,2015-01-23T23:44:52Z,
4024,Path effects applied to annotation text containing \n,2015-01-21T22:11:54Z,2015-10-09T18:33:51Z
3998,Semilog plots with zero values,2015-01-13T16:44:01Z,2015-01-31T09:39:45Z
3982,pgf can not write to `BytesIO` [back port to 1.4.x],2015-01-08T15:00:17Z,2015-01-09T07:47:13Z
3980,zoom in wx with retnia behaves badly,2015-01-08T01:22:04Z,2015-12-09T21:29:49Z
3977,Zooming on images doesn't work properly (anymore),2015-01-07T14:04:33Z,2015-01-07T20:08:38Z
3962,No image appears with nbagg,2015-01-02T16:07:16Z,2015-01-15T15:49:22Z
3922,Line 2256 of patches.py should be removed ,2014-12-15T18:55:00Z,2014-12-15T20:08:43Z
3921,Moving the ticks to the top or to the right resets tick format,2014-12-15T15:14:00Z,
3918,bbox images do not get placed properly when figure is saved to png or pdf,2014-12-13T05:29:26Z,
3895,MarkerStyle Instance not Accepted for scatter,2014-12-05T21:16:07Z,2015-02-19T02:10:28Z
3881,"interactive mode not working with backends gtk3agg, gtk3cairo",2014-12-04T01:37:15Z,
3873,bars plotted on polar axes still have visible boundaries when linewidth is 0,2014-12-02T20:00:41Z,
3872,collections.BrokenBarHCollection.span_where not working with pandas timeseries,2014-12-02T17:46:20Z,
3841,Fill color is always opaque in the pdf backend if there is a hatch pattern,2014-11-24T20:12:32Z,
3824,Path.contains_points() returns a uint8 array instead of a bool array,2014-11-21T14:13:09Z,2014-11-21T16:41:32Z
3817,quiver is not plotting only 1 vector,2014-11-19T21:30:41Z,2015-01-25T19:50:56Z
3816,savefig with bbox_inches='tight' ignores annotation without text,2014-11-19T14:04:22Z,2015-01-31T21:59:44Z
3809,Workaround needed to make example in `Transformations Tutorial` work with log axis,2014-11-16T23:28:20Z,2014-12-09T10:49:52Z
3805,Cannot initialize ColorbarBase without a norm.,2014-11-16T03:33:26Z,2014-11-16T20:59:27Z
3766,Transparency not respected in legendPatch,2014-11-08T01:33:45Z,2014-12-31T22:29:01Z
3763,WebAgg: _png.write_png raises TypeError,2014-11-07T14:45:11Z,2014-11-07T18:09:09Z
3746,matplotlib tooltips for previous plot figure remain stuck to screen with next figure on Mac OS X 10.10,2014-11-01T01:21:39Z,
3734,Image redraw problem on OSX with wx>2.9 & mpl>1.1,2014-10-28T16:10:00Z,2015-01-15T17:34:49Z
3728,eventplot breaks for default `colors=None` kwarg,2014-10-27T12:26:25Z,2014-10-28T16:52:56Z
3722,semilogx and fill_between produce a segmentation fault,2014-10-26T12:58:53Z,2014-12-31T23:09:56Z
3715,Axis labels only move with spines if there are ticks,2014-10-25T08:25:05Z,2015-03-12T23:38:27Z
3709,quiver does not consider direction of an axis,2014-10-23T12:45:36Z,2015-01-25T19:50:56Z
3706,Data draws on top of legend.,2014-10-23T02:28:54Z,
3690,Using Ctrl-W to close a matplotlib window opened by exec-ing a script in wxpython causes a segfault under linux,2014-10-21T14:40:53Z,
3633,twinx clear problem,2014-10-10T20:27:08Z,2015-01-27T06:11:06Z
3626,"Manual xlim log stackplots not showing, linear stackplots segfault",2014-10-09T06:06:55Z,2014-12-27T22:51:50Z
3622,"setup.py creates a zombie C extension called ""freetype2""",2014-10-07T21:03:17Z,2014-10-10T18:42:18Z
3574,`rotation` parameter has no effect on `RegularPolyCollection`,2014-09-27T14:10:09Z,2014-09-30T15:26:01Z
3557,Bug fix for plotting minor ticks,2014-09-23T04:08:14Z,2015-01-13T05:08:47Z
3553,fill_between disappears on axis limit change,2014-09-22T20:16:56Z,2014-11-21T13:21:19Z
3540,Pick events broken in log axes,2014-09-19T01:35:43Z,
3522,Inverting a datetime / plot_date y-axis,2014-09-16T13:35:58Z,2014-09-27T03:49:50Z
3514,Ticks on top axis disappear if tick size is too large (when using bbox_inches='tight'),2014-09-14T14:02:45Z,2014-09-27T18:13:11Z
3493,Incorrect use of super() in mplot3d?,2014-09-10T12:16:15Z,2014-09-13T15:58:44Z
3483,Cannot properly reload figure that was previously pickled,2014-09-07T16:31:45Z,2015-02-28T23:58:26Z
3473,afm.py error in python3,2014-09-05T13:44:52Z,2015-07-21T14:46:19Z
3444,Assume backend/optional package checks fail after defined timeout,2014-08-31T15:52:25Z,2014-11-10T20:20:41Z
3404,Wrong plot on basemap with `latlon=True` ,2014-08-25T10:56:37Z,2014-08-26T12:50:14Z
3400,Errorbar does not plot errorbars centered on the marker,2014-08-22T20:13:45Z,
3392,Cannot pickle `figure` or `axes` (TypeError: instancemethod),2014-08-21T14:34:23Z,2014-10-10T17:01:51Z
3371,Incorrect PDF output with rasterized=True,2014-08-15T14:28:06Z,
3336,Boxplot shows wrong color for lower outliers,2014-08-01T07:44:46Z,2014-08-07T12:44:38Z
3316,wx crashes on exit if figure not shown and not explicitly closed ,2014-07-27T13:33:03Z,2015-12-09T13:57:22Z
3304,1.4.0 RC1+7: *** glibc detected *** python: corrupted double-linked list,2014-07-25T14:51:22Z,2014-07-31T03:14:41Z
3298,Wedge not honouring specified angular range,2014-07-24T11:18:17Z,2014-10-19T04:27:01Z
3286,colorbar doesn't work correctly with pcolormesh and polar projection,2014-07-22T17:53:46Z,
3196,Issue with iterability of axes arguments [backport to 1.4.x],2014-07-07T19:54:23Z,2014-12-03T16:39:34Z
3173,Issues with clipping image in display coordinates,2014-06-30T16:35:22Z,
3166,"subplot(x, x, 0) should raise Exception",2014-06-29T17:34:54Z,2014-07-11T16:28:39Z
3117,Qt4 backend using unichr() in python3,2014-06-05T21:55:10Z,2014-06-10T12:44:44Z
3095,Memory issue when plotting large arrays with pcolormesh,2014-05-30T12:27:49Z,2015-01-31T18:15:45Z
3091,set_xlim() crashes kernel if interpolation='none',2014-05-27T21:54:51Z,2014-06-01T13:18:39Z
3059,scatter drops points if xscale is activated TOO LATE,2014-05-13T12:10:00Z,
3057,DPI-connected bug of imshow when using multiple masked arrays,2014-05-10T19:40:21Z,2016-02-18T02:36:03Z
3028,Import error QT4 backend with python3.2.3,2014-04-30T20:40:55Z,2014-05-03T23:41:29Z
3026,Bug in matplotlib.mlab.levypdf,2014-04-30T17:15:22Z,2014-05-03T14:49:05Z
3023,contourf hatching and saving to pdf,2014-04-29T14:25:24Z,2016-11-14T21:51:02Z
3020,Polygons from contour patches don't capture vertices,2014-04-28T17:23:12Z,
2980,get_window_extent method for an image object gives all zeros,2014-04-15T04:26:45Z,2014-11-30T15:13:12Z
2973,Clabel and Setting Axis Limits,2014-04-11T14:29:23Z,
2964,line style rendering error,2014-04-09T19:21:25Z,2014-04-11T00:55:19Z
2963,Segmentation Fault on adding BBoxImage to matshow,2014-04-09T01:58:49Z,2014-06-04T17:41:29Z
2941,Order of ax.spines[].set_position() and ax.yaxis.set_major_formatter() produces different results,2014-03-29T21:27:02Z,2014-06-02T12:15:33Z
2935,Non-accurate placing of images from plt.imshow in PDF output,2014-03-28T14:15:00Z,
2842,matplotlib.tests.test_basic.test_override_builtins() fails with Python >=3.4,2014-02-25T19:28:07Z,2016-05-22T04:55:58Z
2827,polar rgb imshow xticks issue,2014-02-21T13:30:34Z,
2823,Remove spacing between polygons,2014-02-20T09:03:08Z,
2808,BUG: master has broken some 3d plots,2014-02-13T08:04:57Z,2014-03-08T03:42:16Z
2792,Disable legend on matplotlib.axes instance,2014-02-05T20:33:44Z,2014-02-10T11:49:44Z
2790,zooming problem on figures with shared axes,2014-02-05T09:06:29Z,
2732,AttributeError: 'Patch3DCollection' object has no attribute 'set_sizes',2014-01-15T09:29:14Z,2014-01-29T14:42:54Z
2722,limited number of grid lines in matplotlib?,2014-01-12T00:11:58Z,2017-01-08T19:33:53Z
2688,Deleting axis in matplotlib > v1.2.1 does not work similar to v1.1.1,2013-12-18T15:08:16Z,2014-06-11T16:58:27Z
2675,clip_on = False does not work for x-axis,2013-12-12T04:53:37Z,2014-01-28T09:50:34Z
2616,Quiver does not _init with animated=True and quiverkey attached,2013-11-26T18:06:28Z,2014-02-25T14:22:49Z
2602,stem function with datetime argument does not work in 1.3.1,2013-11-19T11:05:55Z,2014-05-16T19:57:06Z
2556,Quiver leaks memory when called multiple times,2013-10-28T20:44:16Z,2014-01-27T16:39:13Z
2533,"Bug in mplot3D with PolyCollection: (0, 0) data point is always inserted into the data set.",2013-10-21T12:50:12Z,2014-07-12T21:46:09Z
2525,cfl() doesn't clear gcf()._suptitle,2013-10-16T19:08:50Z,2014-01-09T10:46:57Z
2517,PDF output does not respect zorder when using imshow,2013-10-14T07:54:31Z,2015-07-17T04:00:49Z
2492,subplots() shared scale is off,2013-10-03T13:48:01Z,2014-06-06T12:50:17Z
2425,DOC: `axis_off` wrongfuly appears as a parameter to Figure.add_subplot,2013-09-16T09:46:01Z,2013-09-27T14:49:28Z
2423,Off-axes markers unnecessarily saved to PDF,2013-09-13T22:22:23Z,2014-01-09T13:31:35Z
2418,"AssertionError with quiver, quiverkey, and an additional patch.",2013-09-12T14:31:44Z,2013-09-27T14:50:11Z
2394,AnchoredSizeBar does not respect FontProperties size setting.,2013-09-09T02:33:42Z,2014-07-06T21:22:38Z
2355,Type Error in bar3d plot when saved as svg,2013-08-29T15:30:24Z,2014-08-17T22:03:09Z
2341,"PatchCollection doesn't properly handle FancyArrowPatch, breaking StreamplotSet.arrows",2013-08-24T07:03:14Z,
2337,pylot tutorial's codes are missing statements,2013-08-23T17:31:44Z,2013-08-26T15:10:43Z
2329,set_position on Annotation is not working,2013-08-22T12:38:19Z,2013-11-27T08:21:09Z
2299,Mollweide projection no longer shows horizontal gridlines,2013-08-15T17:38:24Z,2013-08-27T14:46:45Z
2296,rc defaults incorrectly interpreted by colorbar,2013-08-14T20:23:16Z,2013-08-29T01:42:09Z
2294,tex option not respected by date x-axis,2013-08-13T05:11:32Z,
2229,Matplotlib does not display hatching when rendering to pdf in fill_between,2013-07-18T14:11:09Z,2013-09-05T12:29:47Z
2197,pyplot.errorbar: problem with some shapes of the positional arguments,2013-07-02T23:30:35Z,2014-04-28T17:17:57Z
2187,Building documentation from the tarball fails,2013-07-01T13:57:12Z,2013-07-19T16:20:00Z
2113,hist() bottom line now showing (regression?),2013-06-02T11:45:45Z,2013-06-03T18:32:23Z
2104,Bug in cbook.exception_to_str() in v 1.2,2013-05-31T15:39:23Z,2013-06-03T13:45:21Z
2035,legend marker update bug,2013-05-21T08:44:59Z,
1986,Importing pyplot messes with command line argument parsing,2013-05-08T16:25:49Z,2016-02-15T22:35:21Z
1980,Custom marker created from vertex list scales wrong,2013-05-06T23:13:33Z,2014-08-26T03:42:02Z
1962,"When legend is outside the axes, pick events get handled twice",2013-04-30T11:00:28Z,2014-02-01T03:56:22Z
1960,"Right and top spine placement: set_position(('data', x)) puts the spine at x + 1 instead of x.",2013-04-29T12:20:42Z,2013-06-16T21:13:42Z
1957,matplotlib 1.2 / pylab_examples example code: multiple_yaxis_with_spines.py,2013-04-28T10:59:26Z,2013-05-03T23:18:27Z
1910,Pylab contourf plot using Mollweide projection create artefacts,2013-04-16T06:41:31Z,2016-11-27T18:45:36Z
1897,Doc build failure - unicode error in generate_example_rst,2013-04-12T11:33:38Z,2013-04-17T14:17:58Z
1894,Exporting figure as pdf using savefig() messes up axis background in OS X,2013-04-09T22:11:22Z,2013-04-12T14:39:24Z
1883,Cairo backend reports file closed on writing to SVGZ file format.,2013-04-04T17:02:13Z,2015-07-17T03:52:20Z
1810,Cairo + plot_date = misaligned x-axis labels,2013-03-06T05:45:18Z,2013-04-19T20:16:41Z
1769,FunctionAnimator tries to take length of iterator,2013-02-20T13:52:02Z,2014-01-06T10:10:11Z
1758,y limit with dashed or dotted lines hangs with somewhat big data,2013-02-18T14:58:09Z,2016-05-22T03:58:20Z
1751,Polygon is corrupted with SVG backend in a certain condition,2013-02-16T00:49:26Z,2014-10-19T04:52:41Z
1747,NotImplementedError: cannot remove artist,2013-02-13T12:11:57Z,2014-01-09T10:48:38Z
1737,MacOSX backend unicode problems in python 3.3,2013-02-04T21:45:51Z,2013-05-20T19:37:21Z
1733,im.set_clip_path(rectangle) doesn't work,2013-02-02T09:00:10Z,2014-01-23T12:57:53Z
1719,"Can't pickle bar plots: Failed to pickle attribute ""gridline""",2013-01-30T02:42:21Z,2016-10-22T08:23:59Z
1679,matplotlib-1.2.0: regression in histogram with barstacked drawing?,2013-01-17T16:29:00Z,2013-03-01T17:13:10Z
1673,Images saved as SVG get upside down when `svg.image_noscale` is True.,2013-01-17T03:05:32Z,2013-01-18T00:58:23Z
1591,Image being snapped erroneously,2012-12-12T11:29:13Z,2013-03-22T16:08:20Z
1541,Transparecy of figures in 3D plots (mplot3d),2012-11-28T17:51:44Z,2014-07-11T21:58:14Z
1539,Pickling of log axes,2012-11-28T11:03:36Z,2013-05-10T19:31:03Z
1530,saving a figure triggers (very) excessive IO activity ,2012-11-24T16:32:20Z,2013-05-24T19:28:41Z
1501,Panning and zooming does not work on axes created with twinx (and twiny),2012-11-15T15:05:55Z,2014-08-18T00:47:29Z
1499,twinx() on an inset axes wrongly acts on the main axes,2012-11-14T22:54:22Z,2014-02-25T02:13:38Z
1495,"scatter docstring, minor",2012-11-13T21:47:56Z,2012-11-14T00:07:14Z
1490,empty scatter messes up the limits,2012-11-13T18:08:11Z,2013-02-17T20:58:59Z
1465,Undefined elements in axes module,2012-11-08T16:51:45Z,2012-12-07T04:14:07Z
1444,Colorbar edges are different in PDF backend,2012-11-01T13:06:09Z,2012-11-01T17:13:41Z
1441,Misalignment imshow vs. grid lines,2012-10-31T13:07:35Z,
1424,pcolor fails if edgecolors is not a string,2012-10-22T12:30:09Z,2012-10-23T14:02:14Z
1415,Plot title should be shifted up when xticks are set to the top of the plot,2012-10-19T13:17:07Z,
1371,vertical alignment of yticklabels fails on `0`,2012-10-12T15:45:08Z,2014-01-16T22:39:32Z
1343,Date axis formatter problem,2012-10-08T18:47:00Z,2012-10-14T05:09:56Z
1325,Auto-scaling of extent not working for subplots when using sharex and sharey,2012-10-03T21:17:06Z,2015-07-17T03:50:44Z
1318,qt4backend zoom-to-rect box is drawn incorrectly on OSX,2012-09-29T19:52:57Z,2015-07-18T18:56:28Z
1316,very high negative zorder breaks vector graphic rendering,2012-09-27T14:12:13Z,2012-10-01T22:11:41Z
1310,Drops last tick label for some ranges,2012-09-25T21:34:43Z,2013-04-09T04:05:35Z
1307,Marker not round with markersize=3,2012-09-25T13:30:09Z,2012-09-26T10:19:04Z
1302,pcolormesh bug: edgecolor ignored,2012-09-24T15:41:19Z,
1295,Exception when using Container.remove,2012-09-21T22:40:18Z,2012-09-22T06:25:42Z
1249,transAxes isn't working properly with scale='log',2012-09-14T11:25:31Z,2012-09-18T18:55:10Z
1246,axvline fails with log scaling,2012-09-14T09:00:56Z,2012-09-18T18:54:58Z
1235,Legend placement bug,2012-09-12T18:45:48Z,2016-03-07T14:11:57Z
1211,PDF renderer draws strange artifacts on '%' character in 1.1.1,2012-09-07T11:30:12Z,2012-09-10T15:28:30Z
1203,multi-subplot animation problem,2012-09-04T17:51:58Z,2014-01-22T15:13:30Z
1194,Streamplot result python version dependent,2012-09-02T20:00:14Z,2012-09-03T11:21:04Z
1193,Cairo backend ignores alpha in imshow. ,2012-09-02T09:39:20Z,2014-01-28T09:40:07Z
1188,Errors in rendering boundaries between filled paths and within a quadmesh,2012-09-01T20:26:13Z,
1172,Axes.tick_params() fails with labelsize=<string> and direction='out',2012-08-30T04:45:44Z,2013-11-30T02:01:46Z
1110,twiny overrides formatter and adds another x-axis,2012-08-19T23:01:15Z,2012-09-04T16:54:28Z
1089,savefig to sys.stdout fails with pdf backend,2012-08-15T11:13:29Z,2012-09-19T17:52:11Z
1059,Matplotlib figure window freezes during interactive mode,2012-08-07T21:09:35Z,2012-08-16T18:46:13Z
1045,1.1.1 not in pypi,2012-07-28T17:39:21Z,2012-08-19T17:00:08Z
1039,Cairo backend marker/line style,2012-07-25T15:35:05Z,2016-10-10T21:01:39Z
1024,broken links in the gallery,2012-07-19T11:41:39Z,2012-08-03T19:44:58Z
1005,imshow with big-endian data types on OS X,2012-07-10T23:08:31Z,2012-08-19T19:10:44Z
966,axes_grid: indicate the axes for the suplot with append_axes,2012-06-27T14:13:20Z,2014-03-24T14:10:21Z
950,Gridspec example in documentation doesn't run,2012-06-15T16:21:27Z,2012-06-17T07:03:47Z
944,Memory issue using PdfPages,2012-06-11T18:45:19Z,
916,Figure sizing problems in most backends,2012-06-01T19:16:15Z,
854,Bug in Axes.relim when the first line is y_isdata=False and possible fix,2012-04-26T22:30:55Z,2013-05-29T16:12:26Z
841,Error autoscaling histogram with histtype='step',2012-04-18T23:20:39Z,2014-01-27T18:16:15Z
835,add documentation for figure show method in backend_bases and backend_template,2012-04-16T19:08:34Z,2012-09-05T17:11:33Z
808,pip install matplotlib fails,2012-03-31T05:05:14Z,2012-06-30T17:17:31Z
807,"Crash when using zoom tools on a plot: AutoMinorLocator after MultipleLocator gives ""ValueError: Need at least two major ticks to find minor tick locations""",2012-03-29T09:44:47Z,2012-08-06T20:26:36Z
804,pdf backend bug with logarithmic plots,2012-03-28T18:27:08Z,2012-04-13T20:20:06Z
796,im caching in draw_tex,2012-03-24T03:58:26Z,2015-07-17T02:59:42Z
775,TypeError in Axes.get_legend_handles_labels,2012-03-19T19:59:35Z,2013-01-26T05:44:34Z
769,GTK Warning message emitted when interactively saving figure,2012-03-16T20:59:06Z,2012-03-23T01:00:17Z
761,"mplot3d, addition to losing color on movement of canvas.",2012-03-12T23:33:57Z,2012-09-20T13:43:29Z
749,set_xlim in 3D scatter plots?,2012-03-08T21:04:21Z,2012-09-20T13:49:05Z
740,plt.pcolormesh and shape mismatch,2012-03-05T09:32:17Z,2013-05-22T18:24:24Z
711,no 'close_event' emitted with Qt4Agg backend,2012-02-23T13:38:19Z,2012-03-10T22:20:24Z
698,Text ignores rotational part of transformation,2012-02-09T03:07:38Z,
688,bbox_inches='tight' clips figure.suptitle,2012-01-29T20:19:19Z,2012-03-10T22:20:58Z
676,Error in documentation of matplotlib.pyplot.ticklabel_format,2012-01-16T14:46:30Z,2012-10-19T09:19:27Z
673,imread() not working on master,2012-01-14T23:16:07Z,2012-01-15T06:58:07Z
621,savefig to pdf and ps don't respect mew=0 or mec,2011-12-13T01:14:12Z,2012-01-01T09:15:29Z
563,sankey.add() has mutable defaults,2011-10-30T21:44:14Z,2012-08-21T13:22:21Z
560,QuadMesh.draw(): convert_xunits broken,2011-10-27T21:03:16Z,2013-07-22T14:26:08Z
545,Broken alpha handling in images,2011-10-21T13:30:14Z,2011-10-28T17:25:52Z
530,patch: font_manager glob problems cause failure to import matplotlib,2011-10-16T00:43:59Z,2011-10-21T14:23:26Z
525,key press events require window click in qt4agg,2011-10-14T14:01:55Z,2012-03-10T22:22:38Z
520,example source code in website is missing,2011-10-12T23:58:16Z,2011-10-19T18:20:16Z
510,Missing font-size units in SVG,2011-10-06T15:05:16Z,2011-10-21T18:14:42Z
441,Polar plot error bars don't rotate with angle,2011-08-29T09:02:28Z,
429,undefined behavior of figure.add_subplot() once subplot is modified.,2011-08-19T03:27:34Z,2014-01-16T21:37:09Z
412,legend's numpoints not working,2011-08-05T15:29:09Z,2011-08-08T15:05:03Z
408,Small issue with hist (probably in mac os x backend),2011-07-27T14:43:09Z,2011-11-08T14:39:55Z
