id,summary,status,owner,type,component,version
16911,Spelling,closed,nobody,Bug,contrib.comments,1.3
16910,Misleading regex in urlpatterns inclusion example,closed,nobody,Bug,Documentation,1.3
16909,django.utils.formats.get_format function uses wrong language,closed,jezdez,Bug,Internationalization,1.3
16908,Broken image url,closed,nobody,Bug,Documentation,1.3
16900,utils.dictconfig and utils.unittest don't work with python 3.0 and 3.1,closed,adsworth,Bug,Python 3,1.3
16899,Wrong offset for Europe/Moscow,closed,nobody,Bug,Core (Other),1.3
16898,Throwing an exception out of a custom field (or any QuerySet._results_iter callable) results in a bad _results_cache,closed,nobody,Bug,"Database layer (models, ORM)",1.3
16897,"makemessages option_list default value for ""extensions"" is missing .txt",closed,nobody,Bug,Core (Management commands),1.3
16894,UnicodeDecodeError handled incorrectly in WSGIHandler.__call__(),closed,nobody,Bug,Core (Other),1.3
16893,negation of Q object returns the same thing,new,nobody,Bug,"Database layer (models, ORM)",1.2
16889,Extra method containing %...,closed,nobody,Bug,Uncategorized,1.3
16888,USE_L10N and microseconds,closed,claudep,Bug,Internationalization,master
16886,Memcached socket file usage is undocumented,closed,nobody,Bug,Documentation,master
16885,django.test.testcases.connections_support_transactions always returns False if TEST_MIRROR is used,closed,nobody,Bug,Testing framework,master
16883,Importing models.py from not-installed app prevents any other app with that label from loading,closed,nott,Bug,"Database layer (models, ORM)",master
16879,request.user does not synchronize using SET_SESSION_COOKIE,closed,nobody,Bug,contrib.auth,1.3
16877,documentation code blocks cropped on mobile browsers,closed,nobody,Bug,*.djangoproject.com,1.3
16876,Settings SHORT_DATETIME_FORMAT documentation cross-references itself,closed,nobody,Bug,Documentation,master
16873,removal of deprecated settings.DATABASE code causes shell scripts to raise  ImproperlyConfigured,closed,ptone,Bug,"Database layer (models, ORM)",master
16870,CSRF too strict when no referer is present,closed,nobody,Bug,CSRF,master
16869,BaseGenericInlineFormSet does not use form's save() method,closed,pyriku,Bug,contrib.contenttypes,1.3
16868,Typo in last code fragment in tutorial part 3,closed,nobody,Bug,Documentation,1.3
16867,Validate GenericForeignKey's object_id_field/content_type_field options,new,nobody,Bug,contrib.contenttypes,1.3
16866,Handling empty list of candidates in select_template function,closed,Silver_Ghost,Bug,Template system,master
16865,get_or_create defaults to _for_write even when it's just reading,closed,nobody,Bug,"Database layer (models, ORM)",1.3
16864,django.contrib.gis.geos.GEOSGeometry doesn't accept -1 as SRID value (or any negative number) in WKT format,closed,nobody,Bug,GIS,master
16862,Admin delete-cascade check doesn't support per-object permissions,new,,Bug,contrib.admin,master
16861,Fixtures do not work with namespaced apps,closed,nobody,Bug,Uncategorized,1.3
16858,incr() on locmem cache resets the expiry time,closed,berkerpeksag,Bug,Core (Cache system),1.5-rc-1
16855,select_related doesn't chain as expected,closed,nobody,Bug,"Database layer (models, ORM)",master
16854,AttributeError on syncdb,closed,nobody,Bug,Core (Management commands),master
16853,"Slugify removes dotless ""i""",closed,nobody,Bug,Template system,1.3
16852,"""Save and continue editing"" and ""Save and add another"" swapped in 1.3.1",closed,julien,Bug,contrib.admin,1.3
16850,Testsuite failing on JSON serialization,closed,nobody,Bug,Core (Serialization),1.3
16849,loaddata - --help text incorrect?,closed,nobody,Bug,Documentation,1.3
16848,r16830 creates a lot of failures in the test suite,closed,nobody,Bug,HTTP handling,1.3
16846,"No form method ""non_form_errors()""",closed,nobody,Bug,Documentation,1.3
16843,"Missing ""Django badges"" page",closed,nobody,Bug,*.djangoproject.com,1.3
16842,RedirectView (class based) query string format bug,closed,nobody,Bug,Generic views,1.3
16840,Bogus QuerySet.distinct(...) and QuerySet.select_related(...) arguments do not result in errors,closed,nobody,Bug,"Database layer (models, ORM)",1.3
16839,"1.2.6, 1.2.7 and 1.3.1 release notes are not visible in stable documentation",closed,nobody,Bug,Documentation,1.3
16838,"First InlineModelAdmin not displaying ""Add Another"" link when related_name='+'",closed,nobody,Bug,contrib.admin,master
16837,updated error message when logging in into the admin fails because is_staff is False,closed,wimfeijen,Bug,contrib.admin,1.3
16836,can't create super-user w/ domain of localhost,closed,nobody,Bug,contrib.auth,1.3
16834,wrong error message when entering admin and not is_staff or is_active,closed,nobody,Bug,contrib.admin,1.3
16831,Radioselect input loose id after invalid submission,closed,Nelson Monteiro,Bug,HTTP handling,1.3
16830,Radioselect input loose id after invalid submission,closed,Nelson Monteiro,Bug,HTTP handling,1.3
16828,Upgrade from 1.3 to 1.3.1 breaks manage.py test with multiple databases,closed,nobody,Bug,Testing framework,1.3
16827,validate CSRF token (Check length),closed,raulcd,Bug,CSRF,1.3
16826,Overwriting max_decimal_places error message in forms.DecimalField raises Exception,closed,nobody,Bug,Forms,1.3
16825,Broken links (for logos & badges),closed,nobody,Bug,*.djangoproject.com,
16824,"Badges, logos links not working",closed,nobody,Bug,*.djangoproject.com,1.3
16823,syncdb fails with errno 150 when using MySQL 4.0 with InnoDB,closed,nobody,Bug,"Database layer (models, ORM)",1.3
16822,HTTPRequest::raw_post_data broken for tests,closed,nobody,Bug,HTTP handling,
16821,No doc for submitting CLA (or not obviously findable),closed,nobody,Bug,Documentation,1.3
16820,CheckboxInput.value_from_datadict with '0',closed,nobody,Bug,Forms,1.3
16819,list_editable breaks multipage changelists,closed,nobody,Bug,contrib.admin,master
16818,Regression introduced by r16739 -- `ManyRelatedManager.add()` doesn't commit to database,closed,nobody,Bug,"Database layer (models, ORM)",master
16816,URLField validation mock added in r16451 neutered by changes from r16760,closed,nobody,Bug,Testing framework,master
16815,Broken example code -- hidden fields won't show if there aren't visible fields.,closed,nobody,Bug,Documentation,1.1
16814,the page https://www.djangoproject.com/download/ is down!,closed,nobody,Bug,Uncategorized,1.3
16813,"changeset 16789 removed supports_inactive_user checks to early, should happen in 1.5",closed,poirier,Bug,contrib.auth,master
16812,FieldsTests.test_urlfield_10 fails since r16760,closed,nobody,Bug,Forms,master
16809,MySQL is not SQL standards compliant regarding IS NULL criteria on newly-inserted auto-incremented fields,closed,nobody,Bug,"Database layer (models, ORM)",1.3
16806,Wrong link in a documentation,closed,nobody,Bug,Documentation,1.3
16805,Flatpages middleware does not alter status_code back to 200,closed,nobody,Bug,contrib.flatpages,1.3
16804,Problem with Django 1.2.6 - Patch isn't in online tar.gz,closed,nobody,Bug,Uncategorized,1.2
16803,Unicode representation of ContentType instances is not translated,closed,isagalaev,Bug,contrib.contenttypes,1.3
16795,ORM masks exception in Python shells,closed,nobody,Bug,"Database layer (models, ORM)",1.3
16790,GeoDjango tutorial error (selecting WorldBorders via admin crashes),closed,jdiego,Bug,GIS,master
16787,{% load %} doesn't work with libraries in package heierarcy,closed,isagalaev,Bug,Template system,1.3
16784,FormWizardWithNullBooleanField regression test failing,closed,nobody,Bug,Forms,master
16782,Link to other database backends in the tutorial is no longer functional (as of 1.3),closed,cmheisel,Bug,Documentation,1.3
16781,Wrong SQL for a query-set,closed,nobody,Bug,"Database layer (models, ORM)",1.3
16778,Bad geometry escape in postgis,closed,nobody,Bug,GIS,1.3
16776,jQuery.noConflict(false) in jquery.init.js leaks the admin jQuery into the global namespace,closed,julien,Bug,contrib.admin,master
16773,QuerySet.count does no caching until the result cache is filled,closed,nobody,Bug,"Database layer (models, ORM)",1.3
16772,https://code.djangoproject.com Getting Involved points to 1.3 goals,closed,nobody,Bug,*.djangoproject.com,1.3
16771,https://code.djangoproject.com old link to subversion,closed,nobody,Bug,*.djangoproject.com,1.3
16770,Don't wrap exceptions in TemplateSyntaxError under DEBUG,closed,jMyles,Bug,Template system,1.3
16769,Test Ticket,closed,PaulM,Bug,*.djangoproject.com,1.3
16768,Wrong cookie set by CSRF middleware,closed,nobody,Bug,CSRF,1.3
16767,get_or_create does not raise error even though i didn't give a primary key to it,closed,nobody,Bug,"Database layer (models, ORM)",1.3
16765,Not showing any list_display_links is possible with Debug=False but not with Debug=True,closed,nobody,Bug,contrib.admin,1.3
16764,LANGUAGES and LANGUAGE_CODE settings doesn't work correctly,closed,gaba,Bug,Internationalization,1.3
16763,code.djangoproject.com won't stop emailing me (doesn't abide by cc/reporter/etc),closed,nobody,Bug,*.djangoproject.com,
16762,Inline delete field,closed,nobody,Bug,contrib.admin,1.3
16759,Expensive sql.Query cloning,closed,Suor,Bug,"Database layer (models, ORM)",1.3
16757,GeoDjango SpatiaLite returns unicode for dates,closed,jbronn,Bug,GIS,1.3
16756,Edit item with non integer value and inheritance fails on id.,closed,nobody,Bug,contrib.admin,1.3
16755,syncdb confuses any app named auth with its own,closed,nobody,Bug,Core (Management commands),1.3
16754,forms.extras.widgets.SelectDateWidget.render ignores 'attr' parameter,closed,nobody,Bug,Forms,1.3
16753,Handle protocol-relative URLs in syndication,closed,nobody,Bug,contrib.syndication,master
16752,Multi-db without a 'default' database,new,nobody,Bug,"Database layer (models, ORM)",1.3
16751,GET variable names replaced by 'e',closed,nobody,Bug,contrib.admin,1.3
16747,IntegerField could validate too large numbers to work with PostgreSQL and MySQL be default,closed,nobody,Bug,"Database layer (models, ORM)",master
16745,Different times on fields with auto_now and auto_now_add,new,michaelmior,Bug,"Database layer (models, ORM)",1.3
16743,django-admin.py check for database config includind during help subcommand,closed,nobody,Bug,Core (Management commands),1.3
16741,"Naming a model field to ""num_connections"" causes syncdb to seemingly ignore it (mysql)",closed,nobody,Bug,"Database layer (models, ORM)",1.2
16739,Model field clash not detected beyond parent,closed,,Bug,Core (System checks),master
16738,permalink doc fix,closed,danodonovan,Bug,Documentation,master
16737,inspectdb does not handle non-ascii column names correctly,closed,nobody,Bug,"Database layer (models, ORM)",1.3
16736,AdminEmailHandler ignores user args to log message.,closed,strioni,Bug,Core (Other),1.3
16734,urlresolvers doesn't get a script prefix from manage.py,new,nobody,Bug,Core (Management commands),1.3
16733,pk/id bug in multiple inheritance of concrete classes,closed,nobody,Bug,"Database layer (models, ORM)",master
16732,Unable to have abstract model with unique_together,new,nobody,Bug,"Database layer (models, ORM)",1.3
16731,startswith endswith and contains doesn't work with F expression,closed,tchaumeny,Bug,"Database layer (models, ORM)",master
16729,inconsistency between doc and code for oracle DB backend,closed,nobody,Bug,"Database layer (models, ORM)",1.3
16728,Registering custom Admin class for User model breaks changing passwords,closed,nobody,Bug,contrib.admin,1.3
16727,contrib.contenttypes.views.shortcut error,closed,tcsorrel,Bug,contrib.contenttypes,master
16724,fix admin interface permission bug,closed,nobody,Bug,contrib.admin,master
16723,Pluralize filter shouldn't pluralize decimal/float values between 1 and 2,closed,,Bug,Template system,master
16722,import psycopg2.Error breaks psycopg2 backend,closed,anonymous,Bug,"Database layer (models, ORM)",master
16721,Blocktrans does not handle correctly litteral percents (%) in content,closed,nobody,Bug,Internationalization,master
16720,"staticfiles_urlpatterns looks for files in MEDIA_ROOT, not STATIC_ROOT",closed,nobody,Bug,contrib.staticfiles,1.3
16718,check_for_language fails when django are imported from zip file,closed,nobody,Bug,Translations,1.2
16716,Regression in admin changelist with failing related admin filters,closed,nobody,Bug,contrib.admin,1.3
16715,Wrong JOIN with nested null-able foreign keys,closed,nobody,Bug,"Database layer (models, ORM)",master
16714,"Can't filter by a related object's field called 'year', 'month' or 'day'",closed,nobody,Bug,"Database layer (models, ORM)",1.3
16713,Fixture loading for tests ignore database specific names,new,nobody,Bug,Testing framework,1.3
16712,Typo in r16697,closed,nobody,Bug,Documentation,1.3
16711,RelatedFieldListFilter and filter title,closed,nobody,Bug,contrib.admin,master
16710,multiple templates per view in class based views do not work,closed,nobody,Bug,Generic views,1.3
16706,values_list on query set ordered by field added by QuerySet.extra() broken,closed,nobody,Bug,"Database layer (models, ORM)",1.3
16705,r13746 makes invalid assumption that QUERY_STRING exists,closed,aaugustin,Bug,Generic views,master
16703,collectstatic management command looks in current working dir instead of project root,closed,nobody,Bug,contrib.staticfiles,1.3
16702,Problem.,closed,nobody,Bug,Documentation,1.3
16701,FormMixin.initial is shared between all child classes,closed,nobody,Bug,Generic views,1.3
16700,The request_started signal is not called for the first request a newly-initialized webserver receives.,closed,nobody,Bug,Documentation,1.3
16699,django.core.urlresolvers.reverse failed with complicated regexp,closed,nobody,Bug,Core (Other),1.3
16696,wrong url validation,closed,nobody,Bug,Uncategorized,1.3
16694,The test suite no longer runs under Oracle since r16678,closed,nobody,Bug,"Database layer (models, ORM)",1.3
16693,Unregistering ModelAdmin view and registering it again changing its contents is not realized when invoking it.,closed,nobody,Bug,contrib.admin,1.3
16692,There should be documentation that cautions about using request.raw_post_data and request.POST together,closed,nobody,Bug,Documentation,1.3
16691,Slicing none() incorrectly returns a list (expected EmptyQuerySet),closed,nobody,Bug,"Database layer (models, ORM)",1.3
16689,Test added in r16679 fails on Python 2.5,closed,nobody,Bug,"Database layer (models, ORM)",1.3
16688,unionagg doesn't respect limits,closed,nobody,Bug,GIS,1.3
16687,Several tests requiring internet fail on Ubuntu build machines,closed,nobody,Bug,Testing framework,1.3
16686,Race condition in test_view_decorator(),closed,nobody,Bug,Core (Cache system),1.3
16684,BaseForm needs to escape the 'class' attribute value,closed,nobody,Bug,Forms,1.3
16683,Make ipv6 tests in regressiontests.admin_scripts.tests.ManageRunserver skippable if ipv6 support isn't present,closed,nobody,Bug,Testing framework,1.3
16682,KeyboardInterrupt not handled properly in transaction aborting,new,nobody,Bug,"Database layer (models, ORM)",1.3
16677,ssi template tag fails when the path to the template contains a space,closed,nobody,Bug,Template system,1.3
16676,The 'add' filter should stringify value or argument if the other value is a string,closed,aaugustin,Bug,Template system,1.3
16674,Django's WSGI Handler should report exceptions to the start_response() callback,new,nobody,Bug,Core (Other),master
16672,Preserve name of TestCase decorated with override_settings,closed,nobody,Bug,Testing framework,1.3
16670,Typo in how to accept a ticket (internals/contributing/#submitting-patches),closed,aroy,Bug,Documentation,1.3
16668,Problem with was_published_today(),closed,nobody,Bug,Documentation,1.3
16666,DateMixIn.get_allow_future() documentation error,closed,nobody,Bug,Documentation,1.3
16664,URLField's to_python method fails with ValueError on some urls on python 2.7,closed,SmileyChris,Bug,Forms,master
16663,Model field choices should accept empty iterator,closed,nobody,Bug,"Database layer (models, ORM)",1.3
16662,Comments  does not set is_public to false for comments under moderation,closed,nobody,Bug,contrib.comments,1.3
16657,"PyPy compat: call termios functions on file descriptors, not file objects",closed,nobody,Bug,Core (Management commands),master
16655,Silent error in ModelAdmin.list_display callables...,closed,nobody,Bug,contrib.admin,1.3
16654,"Wrong example on ""URL dispatcher"" docu page",closed,nobody,Bug,Documentation,1.3
16650,"BaseCommentNode in comments template tags shouldn't filter ""is_public"" comments",closed,nobody,Bug,contrib.comments,1.3
16648,Router unable to delete relationships spanning multiple DBs,closed,nobody,Bug,"Database layer (models, ORM)",1.2
16646,Only first meta inner class inherited with multiple abstract base models.,closed,nobody,Bug,"Database layer (models, ORM)",1.3
16645,OldFormForXTests.test_image_field fails under Oracle,closed,nobody,Bug,Forms,1.3
16644,OldFormForXTests.test_with_data fails under Oracle,closed,nobody,Bug,Forms,1.3
16642,TemplateView get_context_data returns params dict,closed,martinogden,Bug,Generic views,1.3
16641,Ordering not used on ForeignKeyField form field RadioSelect widget,closed,nobody,Bug,contrib.admin,1.3
16640,load static doesn't import from a base template,closed,nobody,Bug,Template system,master
16637,Admin site gives DoesNoteExist at /admin/,closed,nobody,Bug,Documentation,1.4
16636,Wording in documentation for contrib.auth could be improved on is_authenticated(),closed,nobody,Bug,contrib.auth,1.3
16635,Wording in documentation for contrib.auth could be improved on is_anonymous(),closed,nobody,Bug,contrib.auth,1.3
16634,"""m2m_changed"" signals never gets fired from the admin site",closed,nobody,Bug,contrib.admin,1.3
16632,204 (No Content) responses without content-type crashes django if UA is Internet Explorer,closed,aaugustin,Bug,HTTP handling,1.3
16631,Logic in check_settings() in staticfiles app when no base_file is given is wrong,closed,nobody,Bug,contrib.staticfiles,master
16629,STATIC_ROOT should not be required by {% static %} when using development server,closed,nobody,Bug,contrib.staticfiles,master
16627,Warning when building the docs,closed,nobody,Bug,Documentation,1.3
16625,Refresh in Inlinnes,closed,nobody,Bug,Uncategorized,1.3
16624,select_related does not return the objects related,closed,nobody,Bug,Core (Serialization),1.3
16623,APPEND_SLASH changes request method,closed,nobody,Bug,Core (Other),1.3
16620,django.contrib.gis.utils.srs.add_srs_entry doesn't use the database parameter,closed,nobody,Bug,GIS,1.3
16619,Unable to delete IDs > 999 in contrib.admin with THOUSAND_SEPERATOR=True,closed,nobody,Bug,contrib.admin,1.2
16617,URLField with min_length or max_length reports wrong length in validation messages,closed,anubhav9042,Bug,Forms,master
16616,startproject should use virtualenv compatible /usr/bin/env python hashbang for manage.py,closed,nobody,Bug,Core (Management commands),master
16615,UserChangeForm does not handle username changes well,closed,nobody,Bug,contrib.auth,1.3
16613,manage.py test fails on database creation (MySQL),closed,nobody,Bug,Uncategorized,master
16612,Localized form fields cause Form.has_changed() to always return True.,closed,nobody,Bug,Forms,master
16609,Admin searches produce duplicate results if search_fields contains M2M traversals,closed,nobody,Bug,contrib.admin,master
16608,Typo in the doc (Testing Django),closed,nobody,Bug,Documentation,master
16607,NameError for built-in Python functions in Django when working with uWSGI,closed,nobody,Bug,Core (Other),1.3
16605,Can't client.login() in tests if contrib.SessionMiddleware is not in MIDDLEWARE_CLASSES,closed,ramiro,Bug,Testing framework,1.3
16603,Unnecessary join when using a reverse foreign-key filter and reverse foreign-key aggregate call,new,nobody,Bug,"Database layer (models, ORM)",master
16599,Management commands are collected in the wrong order,closed,nobody,Bug,Core (Management commands),1.3
16598,"Lithuanian translation ""svtainės"" in django.contrib.sites is mistyped",closed,nobody,Bug,Translations,1.3
16597,FormWizard doco mentions get_template_names() but does not document it.,closed,jkistler,Bug,Documentation,master
16594,Missing altitude (z) on Point on admin interface for geodjango,closed,nobody,Bug,GIS,1.3
16592,"In MySQL, table names in unmanaged intermediate models are being lower cased",closed,nobody,Bug,Testing framework,master
16591,Bad reference to YEAR_CHOICES,closed,elbarto,Bug,Documentation,1.3
16590,ContentFile does not have name attribute,closed,nobody,Bug,File uploads/storage,master
16589,ModelForm documentation error (saving unbound form),closed,nobody,Bug,Documentation,1.3
16587,get_or_create duplicate entry with together_unique,closed,nobody,Bug,"Database layer (models, ORM)",master
16585,BaseConfigurator importer logical mistake,closed,nobody,Bug,Core (Other),1.3
16583,Explicitly passing a date to a DateTimeField in a model's create method should override auto_now_add,closed,nobody,Bug,"Database layer (models, ORM)",1.3
16582,InlineModelAdmin subclass does not respect the 'extra' field,closed,nobody,Bug,contrib.admin,1.3
16578,l10n tag does not load,closed,nobody,Bug,Template system,1.3
16574,Test fails when setting MESSAGE_TAGS,closed,elbarto,Bug,contrib.messages,1.3
16573,"admindocs ""views"" view returns no urls",closed,nobody,Bug,contrib.admindocs,master
16572,select_related doesn't work (silent/masked TypeError) over multiple one-to-one relationships,closed,nobody,Bug,"Database layer (models, ORM)",1.3
16571,Incorrect unicode template output,closed,nobody,Bug,Template system,1.3
16570,allow DecimalFields with max_digits == decimal_places,closed,kenth,Bug,"Database layer (models, ORM)",1.3
16569,NamedTemporaryFile is missing the delete argument,closed,nobody,Bug,Core (Other),1.3
16568,require_debug_false does not work as intended (backward incompatible),closed,nobody,Bug,Core (Other),master
16566,Typo in docs/ref/files/storage.txt,closed,nobody,Bug,Documentation,master
16565,An issue in databrowse's template object_detail.html,closed,nobody,Bug,contrib.databrowse,1.3
16563,Error pickling request.user,closed,nobody,Bug,contrib.auth,1.3
16562,intcomma now (incorrectly) requires USE_THOUSAND_SEPARATOR = True,closed,nobody,Bug,contrib.humanize,master
16561,incorrect url in template,closed,nobody,Bug,Documentation,1.3
16558,django.contrib.humanize filters are not well localized,closed,blackraven,Bug,contrib.humanize,1.3
16556,django.contrib.gis.utils.srs fails to preserve database when creating SpatialRefSys querysets,closed,jbronn,Bug,GIS,1.3
16554,Unnecessary join when using a reverse foreign-key relationship in separate filter or aggregate calls,closed,nobody,Bug,"Database layer (models, ORM)",master
16553,GeoIP unicode problem,closed,jbronn,Bug,GIS,1.2
16552,Missing app in Django admin dependency list.,closed,teraom,Bug,Documentation,1.3
16544,"Django tells me I haven't set the database ENGINE, even though I have",closed,nobody,Bug,"Database layer (models, ORM)",1.3
16542,Admin Raw ID widgets can show broken magnifying glass link,closed,ramiro,Bug,contrib.admin,master
16541,"A broken URL should not handled as a 400 bad request, it might a 404 not found",closed,nobody,Bug,HTTP handling,1.3
16540,rev16487 breaks InlineModelAdmin prepopulated_fields,closed,nobody,Bug,contrib.admin,master
16539,ModelForms ignore default values when value is not supplied,closed,nobody,Bug,Forms,1.3
16538,Models fail to sync when using multiple app_label in same models.py,closed,nobody,Bug,"Database layer (models, ORM)",1.3
16537,layermapping spatial ref check not checking against alternate DB,closed,jbronn,Bug,GIS,1.3
16536,inspectdb with numerical column names,closed,teraom,Bug,Core (Management commands),master
16535,UnicodeEncodeError,closed,nobody,Bug,contrib.admin,1.3
16533,pylibmc cache backend raises an exception for float timeouts,closed,jbalogh,Bug,Core (Cache system),1.3
16529,ManyToManyField + CheckboxSelectMultiple widget = wrong help message,closed,nobody,Bug,Forms,1.3
16528,Error in documentation? (test runner return code),closed,teraom,Bug,Documentation,1.2
16525,Bug in get_language_from_request  on python 2.4 and Ukrainian language,closed,nobody,Bug,Internationalization,1.3
16523,manage.py's runserver autoreloading is broken in Jython,closed,nobody,Bug,Core (Management commands),1.3
16522,ManyToManyField incorrectly assumes widget will always be SelectMultiple,closed,nobody,Bug,Forms,1.3
16520,Updated locale formats for hungarian language,closed,nobody,Bug,Internationalization,1.3
16517,Django tests fail if project LOGIN_URL setting doesn't end with '/login/',closed,nobody,Bug,contrib.auth,1.3
16515,Testing with multiple databases assumes sites app installed on all of them,closed,nobody,Bug,Testing framework,master
16514,Classic integer division used in django.template.defaultfilters,closed,kman,Bug,Template system,master
16511,Problem with import and GFK,closed,nobody,Bug,contrib.contenttypes,1.3
16510,`truncatechars` filter is buggy and unregistered,closed,nobody,Bug,Template system,master
16509,"init test db: try insert a existing permission (django.db.utils.IntegrityError: columns content_type_id, codename are not unique)",closed,tobias,Bug,contrib.contenttypes,1.4
16507,Tests that alter ROOT_URLCONF should set DEBUG_PROPAGATE_EXCEPTION,closed,nobody,Bug,contrib.messages,master
16506,admin changelist table does not show correctly in rtl languages,closed,nobody,Bug,contrib.admin,1.3
16502,CreateView useless error message when template_name is not specified,closed,ianawilson,Bug,Generic views,master
16498,GenericIPAddressField Documentation Error,closed,nobody,Bug,Documentation,master
16496,TypeError: float() argument must be a string or a number  ON production server,closed,nobody,Bug,Core (Other),1.3
16494,HttpResponse should raise an error if given a non-string object without `__iter__`,closed,PaulM,Bug,HTTP handling,1.3
