id,summary,status,owner,type,component,version
21943,"Method parameters are garbled, no commas or spaces between them",closed,nobody,Bug,Documentation,1.3
21934,Missing import statements (e.g. unicode literals) in contrib.gis,closed,nobody,Bug,GIS,master
21930,Regression with test django.contrib.gis.tests.test_spatialrefsys,closed,claudep,Bug,GIS,master
21929,Regression with template_tests.test_loaders.EggLoaderTest,closed,nobody,Bug,Template system,master
21928,updating .po files with 'django-admin.py makemessages' under windows with russian locale fail,closed,nobody,Bug,Internationalization,1.7
21925,Error in GIS tests,closed,nobody,Bug,GIS,master
21921,host_validation_re does not match IPv6 addresses,closed,nobody,Bug,HTTP handling,master
21917,Breakage in SQLite migrations,closed,Andrew Godwin <andrew@…>,Bug,Migrations,master
21913,Error 400 without any information if user uploads file to STATIC_ROOT,closed,nobody,Bug,File uploads/storage,1.6
21911,Admin login can cause data loss,closed,nobody,Bug,contrib.admin,master
21909,manage.py sql/migrate fails to product SQL for geometry fields,closed,nobody,Bug,GIS,master
21907,GeoQueryset.transform() broken in Spatialite >= 4,closed,claudep,Bug,GIS,master
21906,dumpdata should not use router.allow_migrate,assigned,andersonresende,Bug,Core (Management commands),1.5
21903,Query with select_related and defer on MySQL causes id field to be returned as bool,closed,nobody,Bug,"Database layer (models, ORM)",1.6
21901,Dependencies on unmigrated apps not always detected.,closed,,Bug,Migrations,1.7-alpha-1
21897,Reset password of djangoproject.com is broken,closed,nobody,Bug,*.djangoproject.com,
21895,Probably erroneous documentation about new contrib.admin and admin.autodiscover,closed,nobody,Bug,Documentation,1.7-alpha-1
21894,Error in example code in django.forms.Form.clean()¶,closed,nobody,Bug,Documentation,master
21893,Migrations RunPython operations seem to trip on MTI models.,closed,Loic Bistuer <loic.bistuer@…>,Bug,Migrations,1.7-alpha-1
21890,django.core.exceptions.FieldError: Local field ... in class ... clashes with field of similar name from base class ...,closed,,Bug,Migrations,1.7-alpha-1
21888,Related model %r cannot be resolved,closed,,Bug,Migrations,1.7-alpha-1
21883,"Use of xrange in custom lookups code not valid in Python 3; ""__in list too long"" case not tested",closed,nobody,Bug,"Database layer (models, ORM)",master
21882,Early modification bug in Django 1.6. with mark_safe + ugettext_lazy,closed,bmispelon,Bug,Internationalization,1.6
21881,Clarify that `{% ssi ... parsed %}` has the same limitations as `{% include %}`,closed,mamun,Bug,Documentation,1.5
21879,Error in reverse m2m query if the model with ManyToManyField has CharField primary key,closed,nobody,Bug,Uncategorized,1.5
21875,"Runtime Error with Django-Tastypie: ""App registry isn't ready yet.""",closed,nobody,Bug,Documentation,1.7-alpha-1
21872,"With custom User, test database is not created due to missing auth.Group relation",closed,Andrew Godwin <andrew@…>,Bug,Migrations,1.7-alpha-1
21871,Apps.is_installed() incorrectly assumes app label is last portion of app dotted path,closed,nobody,Bug,Core (Other),master
21870,Admin Checks fail for list_editable,closed,nobody,Bug,contrib.admin,1.7-alpha-1
21869,Documentation not building on Sphinx 1.2.1,closed,nobody,Bug,Documentation,1.6
21868,Empty migrations dir causes exception,closed,Andrew Godwin <andrew@…>,Bug,Migrations,master
21866,"Static word ""COMMIT""",closed,nobody,Bug,Core (Management commands),master
21864,Unclosed string in custom lookup doc example.,closed,cbarna,Bug,Documentation,
21862,Loading app fails with Python 3.3 resulting in: TypeError: '_NamespacePath' object does not support indexing,closed,nobody,Bug,Python 3,1.7-alpha-1
21859,clarify Django docs re: email addresses and ascii,new,nobody,Bug,Documentation,1.6
21858,Clarify 1.6 release notes regarding ManyToManyField help_text,closed,nobody,Bug,Documentation,1.6
21856,Crash when DATABASES = {},closed,andrewgodwin,Bug,Migrations,master
21854,CharField has default value of u'',closed,nobody,Bug,"Database layer (models, ORM)",1.6
21853,Manager.__module__ holds a wrong value.,closed,nobody,Bug,"Database layer (models, ORM)",master
21852,Migration serializer cannot handle iterators,closed,MarkusH,Bug,Migrations,master
21851,TemplateResponse.status should be TemplateResponse.status_code in Django 1.6 documentation,closed,nobody,Bug,Documentation,1.6
21850,Make GeometryField.geodetic() case insensitive,closed,nobody,Bug,GIS,1.6
21848,Some strange problem in Model inheritance and selected_related,closed,nobody,Bug,"Database layer (models, ORM)",1.6
21846,Admin's NestedObjects doesn't support related_name with %(app_label)s or %(class)s.,closed,nobody,Bug,contrib.admin,master
21843,Schema migration test_operations explicitly set an identity column with raw sql,closed,andrewgodwin,Bug,Testing framework,master
21842,DatabaseFeature.max_index_name_length is redundant of DatabaseOperations.max_name_length,closed,Andrew Godwin <andrew@…>,Bug,Migrations,master
21840,LazyObject wrapped instances can no longer be coerced to Bool due to #20924,closed,bmispelon,Bug,Utilities,master
21837,auth.User Email - non-RFC spec normalization,new,,Bug,contrib.auth,1.6
21834,A simple typo to be fixed,closed,nobody,Bug,Documentation,1.6
21833,Use of new Settings.is_overridden() method breaks if settings.configure() is used,closed,nobody,Bug,Core (Other),master
21831,"If contrib.auth is not in INSTALLED_APPS, any import (even indirectly) of anything within contrib.auth causes Django to fail to startup",closed,nobody,Bug,Core (Other),master
21828,Can no longer use model meta methods in other methods after app loading changes,closed,nobody,Bug,"Database layer (models, ORM)",master
21827,Regression in 1.7: django-admin misses .py suffix,closed,nobody,Bug,Uncategorized,master
21826,"Forgot your password? ""page unavailable""",closed,nobody,Bug,*.djangoproject.com,1.6
21821,ORM lookup refactor broke Oracle tests,closed,akaariai,Bug,"Database layer (models, ORM)",master
21800,CSRF middleware can't get POST data,closed,nobody,Bug,Core (Other),1.6
21795,preserve_filter doesn't work when running a site with a url prefix,closed,nobody,Bug,contrib.admin,1.6
21792,Form.has_changed is not documented,closed,navi7,Bug,Documentation,1.6
21791,RelatedFieldWidgetWrapper object has no attribute decompress,closed,nobody,Bug,contrib.admin,1.6
21790,Don't `except AssertionError` in auth.get_user,closed,timo,Bug,contrib.auth,master
21789,"test failues, django-1.6.1  py3.3",closed,nobody,Bug,Python 3,1.5
21787,Wrong SQL generated when using exclude() and model inheritance,closed,nobody,Bug,"Database layer (models, ORM)",master
21786,migrate fails with certain mixin/model combinations,closed,andrewgodwin,Bug,Migrations,master
21785,migrate fails on DateTimeField with auto_now AND auto_now_add set,closed,andrewgodwin,Bug,Migrations,master
21784,Default values for migrations are not written properly into the migration file.,closed,andrewgodwin,Bug,Migrations,master
21783,Adding a non-nullable field fails on SQLite,closed,Andrew Godwin <andrew@…>,Bug,Migrations,master
21780,Search highlighting on docs.djangoproject.com produces weird results when words overlap,closed,,Bug,*.djangoproject.com,master
21779,Wrong default on isolation level in queryset documentation,closed,nobody,Bug,Documentation,1.6
21774,Running some test labels individually results in PendingDeprecationWarnings,closed,nobody,Bug,Uncategorized,master
21773,development server sometimes takes a long time to restart after source has been changed,closed,mardini,Bug,Core (Management commands),master
21772,additional context for included templates can override current context,new,nobody,Bug,Template system,1.6
21771,ModelAdmin's log_deletion method behaves incorrectly compared to other log methods,closed,nobody,Bug,contrib.admin,master
21770,Management commands autocomplete broken,closed,aaugustin,Bug,Core (Management commands),master
21769,Error message displayed falsely in poll tutorial,closed,nobody,Bug,Documentation,1.6
21768,TemplateView doc describes context incorrectly,closed,nobody,Bug,Documentation,1.6
21767,Invalid usage of ugettext in BaseForm.__init__,closed,nobody,Bug,Forms,master
21766,Can't use reverse() or is_valid_path() with dynamically set TestCase.urls,closed,nobody,Bug,Uncategorized,1.6
21762,django.core.files.Storage#save does not respect settings.FILE_CHARSET,closed,nobody,Bug,File uploads/storage,1.6
21760,prefetch_related uses an inefficient query to get the related fk data,closed,nobody,Bug,"Database layer (models, ORM)",1.6
21758,Document South->built-in migrations transition,closed,andrewgodwin,Bug,Migrations,master
21756,utils_tests.test_dateformat.DateFormatTests failing on Windows with pytz installed,closed,aaugustin,Bug,Utilities,master
21754,"Object discrepency between python2.x and python3.x with model field ""to_python"" and ""get_prep_value"" when retrieving object from database",closed,nobody,Bug,Python 3,1.6
21752,"forms.NumberInput - ""step"" always forced to ""any"", cannot modify",closed,claudep,Bug,Forms,1.6
21750,STATIC_ROOT is required in 1.7,closed,nobody,Bug,contrib.staticfiles,1.6
21749,LocaleMiddleware creates wrong redirects when combined with script prefix,closed,nobody,Bug,Internationalization,1.6
21748,Invalid exclude result for related models,closed,nobody,Bug,"Database layer (models, ORM)",1.6
21746,test_get_reverse_on_unsaved_object doesn't respect DatabaseFeatures.ignores_nulls_in_unique_constraints,closed,nobody,Bug,Testing framework,master
21745,UniqueTest.test_unique_null should honor DatabaseFeatures.ignores_nulls_in_unique_constraints,closed,nobody,Bug,Testing framework,master
21739,When running tests fixture error output isn't visible,assigned,Olek,Bug,Testing framework,1.6
21735,username field uniqueness check should be optional,closed,nobody,Bug,Core (Management commands),1.6
21734,Admin doesn't catch ProtectedError,closed,nobody,Bug,contrib.admin,master
21733,@python_2_unicode_compatible causes infinite recursion when module imported more than once,closed,nobody,Bug,Utilities,1.6
21731,"django.utils.text.javascript_quote does not escape ""</"" (without double quotes)",closed,vajrasky,Bug,Utilities,master
21726,Documentation for REQUIRED_FIELDS on custom users is ambiguous,closed,Tim Graham <timograham@…>,Bug,Documentation,1.5
21725,Javascript translations fail with non-BMP characters,closed,MattBlack,Bug,Internationalization,1.6
21721,Python 3.4 support,closed,nobody,Bug,Python 3,master
21720,python manage.py test fails with empty test label,closed,prestontimmons,Bug,Testing framework,master
21716,The ogrinpsect management command throws TypeError,closed,claudep,Bug,GIS,master
21715,Cannot run tests with the new changes on @master anymore,closed,nobody,Bug,Core (Other),master
21713,"extension ""postgis"" already exists' during syncdb",closed,nobody,Bug,GIS,1.6
21711,Check for duplicate model names,closed,nobody,Bug,Core (Other),master
21709,Admin template bug if there is no username field (custom user),closed,nobody,Bug,contrib.admin,1.6
21705,Generic Relations fail to detect validation error appropritely,closed,nobody,Bug,contrib.admin,1.6
21704,Csrf verification fails for unlogged users with multiple tabs opened,closed,Mimino,Bug,CSRF,1.6
21703,`exclude` query with `F` object across relationship fails,new,nobody,Bug,"Database layer (models, ORM)",1.6
21700,model_to_dict return id key as unicode,closed,nobody,Bug,Forms,master
21696,Allow usage of objects with add_to_query() in filter() calls,closed,nobody,Bug,"Database layer (models, ORM)",1.6
21694,Default filter cannot be used with undefined variables,closed,nobody,Bug,Template system,1.4
21692,'CREATE TABLE' of initial migration doesn't quote table name,closed,Ramiro Morales <cramm0@…>,Bug,Migrations,master
21679,Forbid apps with conflicting labels or names,closed,nobody,Bug,Core (Other),master
21674,django.utils.module_loading.import_by_path considered harmful,closed,berkerpeksag,Bug,Utilities,master
21671,model_inheritance_same_model_name tests fail in isolation,closed,nobody,Bug,"Database layer (models, ORM)",1.6
21670,New Model.save() mechanism causes deadlocks in mysql transactions,new,nobody,Bug,"Database layer (models, ORM)",1.6
21666,Page not found,closed,nobody,Bug,Documentation,1.6
21664,"Migrations and ""Multi-Table"" Inheritance",closed,andrewgodwin,Bug,Migrations,master
21663,sys path not set in wsgi.py,closed,nobody,Bug,Documentation,1.6
21662,Crash if a GEOS prepared geometry's parent geometry loses reference,closed,nobody,Bug,GIS,1.6
21659,password_change_form.html does not use admin_static,closed,nobody,Bug,contrib.admin,1.6
21653,help_text attribute  into TextField model is not converted to the title attribute,closed,nobody,Bug,Forms,1.6
21643,QuerySets that use F() + timedelta() crash when compiling their query more than once,closed,nobody,Bug,"Database layer (models, ORM)",1.6
21639,RenderContext should override __getitem__,closed,nobody,Bug,Template system,master
21638,Infinite migrations when using AUTH_USER_MODEL,closed,Andrew Godwin <andrew@…>,Bug,Migrations,master
21637,Defining objects of models having custom field without any parameter.,closed,anubhav9042,Bug,"Database layer (models, ORM)",1.6
21636,distinct_on_fields tests require DatabaseFeature.ignores_nulls_in_unique_constraints,closed,nobody,Bug,Testing framework,1.6
21633,django.utils.functional.update_wrapper is missing,closed,nobody,Bug,Utilities,1.6
21632,Docs: Unsupported example with a callable as a query parameter,closed,marfire,Bug,Documentation,master
21627,changepassword command fails with unicode characters,closed,jonklo,Bug,contrib.auth,1.6
21625,DiscoverRunner.build_suite docs are incorrect,closed,tianyi,Bug,Documentation,1.6
21623,Page not found,closed,nobody,Bug,Documentation,1.6
21621,Remove kqueue-based autoreloader,closed,nobody,Bug,Core (Management commands),master
21620,HttpResponseBase._convert_to_charset STILL complains about newline it inserted itself,closed,nobody,Bug,HTTP handling,1.6
21617,Impossible to change the language settings with a logged user,closed,nobody,Bug,Internationalization,1.6
21616,Manager isn't available; User has been swapped for 'myuser.MyUser',closed,nobody,Bug,Uncategorized,1.6
21615,contenttypes/generic.py regression from 1.6 --> 1.6.1,closed,nobody,Bug,contrib.contenttypes,1.6
21612,queryset update ignores to_field on foreign keys,closed,nobody,Bug,"Database layer (models, ORM)",master
21610,"Broken link on ""Community"" page",closed,kevin_e,Bug,*.djangoproject.com,master
21609,CONTRIBUTING.rst contradicts the contributing guidelines,closed,nobody,Bug,Documentation,master
21608,Logged out sessions are resurrected by concurrent requests,assigned,anonymous,Bug,contrib.sessions,1.4
21607,"RuntimeError: maximum recursion depth exceeded in ""django.contrib.gis.db.backends.postgis.operations""",closed,nobody,Bug,GIS,1.6
21606,OSMWidget overrides map position passed to widget constructor,closed,jgoclawski,Bug,GIS,1.6
21605,cached_property can't be used in ModelAdmin.list_display,closed,nobody,Bug,contrib.admin,1.5
21600,Template forloop/forloop.parentloop '.last' property failing,closed,nobody,Bug,Template system,1.6
21597,"(2006, 'MySQL server has gone away') in django1.6 when wait_timeout passed",closed,aaugustin,Bug,"Database layer (models, ORM)",1.6
21593,Can't restrict formfield_for_manytomany queryset if the m2m field is django.contrib.auth.models.User,closed,nobody,Bug,contrib.admin,1.6
21589,syncdb fails aparently in the createsuperuser stage,closed,nobody,Bug,"Database layer (models, ORM)",1.6
21583,"Offline HTML docs have wrong version (1.5.4, should be 1.6)",closed,nobody,Bug,Documentation,1.6
21582,URL namespaces and included URLconfs: the example might be confusing,closed,nobody,Bug,Documentation,1.6
21581,collecstatic --clear is too lax about warning users,closed,loic84,Bug,contrib.staticfiles,master
21579,i18n_patterns redirect not working with script prefix (sub path),closed,nobody,Bug,Core (URLs),master
21578,manage.py dumpdata --format=yaml produces naive datetimes in fixtures,closed,nobody,Bug,Core (Serialization),1.6
21577,to_python() of django.db.models.fields.__init__.DateField not detecting datetime.date type,closed,nobody,Bug,"Database layer (models, ORM)",1.6
21574,Different behaviour in Python 2 and 3 when normalizing newlines with django.utils.text.normalize_newlines,closed,vajrasky,Bug,Utilities,master
21569,Making translation string not works in Windows XP?,closed,nobody,Bug,Translations,1.5
21568,ModelMultipleChoiceField + show_hidden_initial + has_changed = TypeError,closed,claudep,Bug,Forms,1.6
21566,Creation of models with ForeignObject fails with bulk_create() function,closed,nobody,Bug,"Database layer (models, ORM)",1.6
21565,values() and values_list() don't work when datetime fields are specified and a GeoManager is used,closed,Marc Tamlyn <marc.tamlyn@…>,Bug,GIS,1.5
21564,Generic base view http_method_not_allowed method references self.request and should use locally scoped request,closed,nobody,Bug,Generic views,1.6
21560,missing 'slug' field in example code,closed,merb,Bug,Documentation,1.6
21559,Generic relations regression in Django 1.6,new,nobody,Bug,"Database layer (models, ORM)",1.6
21558,Build CHM help file format out of box on win32,closed,nobody,Bug,Documentation,1.6
21556,Date field shows in changed_data due to different format,closed,nobody,Bug,Forms,1.5
21555,ValidationError is not picklable,closed,nobody,Bug,Forms,master
21554,incorrect SQL generated when using multiple inheritance,new,nobody,Bug,"Database layer (models, ORM)",master
21553,InterfaceError in Postgres,closed,aaugustin,Bug,"Database layer (models, ORM)",1.6
21551,1.6 regression: Can't load fixtures from subdir,closed,nobody,Bug,Core (Management commands),1.6
21549,Fixture loading should fail with a BIG LOUD EXCEPTION when the file is not found,assigned,bugZPDX,Bug,Core (Management commands),master
21545,runserver goes into an infinite loop after first request on OSX.,closed,nobody,Bug,Core (Management commands),master
21544,Problem with number format when not using L10N,new,Yonel Ceruto,Bug,Utilities,master
21540,TestCase with multiple assertRaises fails with TransactionManagementError,assigned,shaib,Bug,Documentation,1.6
21538,Add numpy to test/requirements/base.txt,closed,nobody,Bug,Core (Other),master
21535,Password hash iterations not updating.,closed,nobody,Bug,contrib.auth,1.6
21532,Django URLValidator fails on some valid URLs,closed,nobody,Bug,Core (URLs),1.6
21531,Django 1.6 forms.SlugField validation error,closed,nobody,Bug,Forms,1.6
21530,urls.py AttributeError: 'RegexURLPattern' object has no attribute 'app_name',closed,nobody,Bug,Core (URLs),1.6
21525,"built in manage.py runserver waits for all content to download before html load attempt, bug?",closed,nobody,Bug,Uncategorized,1.6
21518,override_settings(ROOT_URLCONF) doesn't clear resolver cache,closed,gcc,Bug,Core (URLs),1.6
21514,Session expiry dates should be in an ISO string instead of datetime,new,nobody,Bug,contrib.sessions,1.6
21510,"Admin change list search field is missing the ""show all"" link",closed,claudep,Bug,contrib.admin,1.6
21508,ForeignKey cast to int despite being varchar,new,nobody,Bug,"Database layer (models, ORM)",1.5
21500,PendingDeprecationWarning when running the test suite,closed,nobody,Bug,Core (Other),master
21498,Changing locale causes migrations autodetector to make unnecesary changes,closed,andrewgodwin,Bug,Migrations,master
21497,TypeError when running database migrate command,closed,Tim Graham <timograham@…>,Bug,Migrations,master
21496,Django 1.6 django.contrib.gis GeometryField crashes on alternate widget,closed,nobody,Bug,GIS,1.6
21492,The __in field lookups generates wrong SQL syntax for MySQL when getting QuerySet.query,closed,nobody,Bug,"Database layer (models, ORM)",1.5
21490,Wrong example in docs for reversing Admin URLs using custom instance,closed,nobody,Bug,contrib.admin,master
21488,django-admin.py makemessages with commas separeted multiple locales doesn't work,closed,nobody,Bug,Internationalization,1.6
21487,Incorrect documentation on using timezones and session in 1.6,closed,nobody,Bug,Documentation,1.6
21486,Backwards incompatible change in 1.6: accessing Apache mod_wsgi environment variables,closed,nobody,Bug,Core (Other),1.6
21484,"Document that SQL logging does not include ""framework level"" queries",closed,nobody,Bug,Documentation,1.6
21480,"assertContains(…, html=True) does not work as expected",closed,nobody,Bug,Testing framework,1.6
21473,Cookie based language detection no longer practical,closed,nobody,Bug,Internationalization,master
21472,Django 1.6 ImageField not rendered properly in Admin inline form,closed,nobody,Bug,Forms,1.6
21471,CharField max_lenght is not enforced on SQLite backend with Python 3,closed,nobody,Bug,"Database layer (models, ORM)",1.6
21469,makemigrations and normalize_unique_together,closed,Baptiste Mispelon <bmispelon@…>,Bug,Migrations,master
21468,Django 1.5: Docs on ModelForm validation are wrong,closed,nobody,Bug,Documentation,1.5
21466,override_settings(LOGIN_URL=…) does not work when not first test,closed,nobody,Bug,Testing framework,1.6
21464,readonly_fields is not resetted correctly,closed,nobody,Bug,contrib.admin,1.5
21460,Bug in cache template loader,closed,pmartin,Bug,Template system,master
21458,Encoding error on /jsi18n/?language=ü,closed,nobody,Bug,Internationalization,master
21457,Possible loaddata filename regression,closed,nobody,Bug,Core (Management commands),1.6
21456,Docs typo,closed,nobody,Bug,Documentation,1.6
21452,Connections may be set to autocommit under PostgreSQL when AUTOCOMMIT is set to False.,closed,aaugustin,Bug,"Database layer (models, ORM)",1.6
21451,LiveServerTestCase returns a 404 on all URLs when MEDIA_URL = '' and DEBUG = True,closed,gchp,Bug,Testing framework,1.6
21449,Test Client login does not work without django.contrib.sessions in INSTALLED_APPS,closed,nobody,Bug,Testing framework,1.6
21448,Test Client logout does not work with cookie-based sessions,closed,nobody,Bug,Testing framework,1.6
21447,post parse error no longer correctly represented.,closed,nobody,Bug,HTTP handling,master
21444,Contact the DSF page returns an error when the message is submitted,closed,nobody,Bug,*.djangoproject.com,
21443,"On PY3 if error on import, cannot show debug info",closed,bouke,Bug,Python 3,1.6
21440,URL error in first example,closed,nobody,Bug,Documentation,1.6
21439,UnboundLocalError in auth backends' get_user,closed,nobody,Bug,contrib.auth,master
21438,Migrations do not detect many to many fields,closed,andrewgodwin,Bug,Migrations,master
21437,removed rel_name attribute from BaseInlineFormSet,closed,nobody,Bug,Uncategorized,1.6
21436,"1.5.1 returns ""object has no attribute '_known_related_objects'"" when using the bitwise or operator with objects.get()",closed,nobody,Bug,"Database layer (models, ORM)",1.5
21434,IN clause not supporting the to_field,closed,nobody,Bug,"Database layer (models, ORM)",1.5
21432,datetimes method always raise AttributeError,closed,aaugustin,Bug,Core (Other),1.6
21431,Django 1.6 GenericRelation admin list_filter regression,closed,nobody,Bug,contrib.admin,1.6
21428,Django 1.6 GenericRelation editable regression,closed,nobody,Bug,"Database layer (models, ORM)",1.6
21420,Runserver autoreload defect on OSX,closed,nobody,Bug,Core (Management commands),master
21419,Model validation inspects models not present in INSTALLED_APPS,closed,nobody,Bug,Uncategorized,1.6
21417,use TEMPLATE_STRING_IF_INVALID format string in blocktrans,closed,Claude Paroz <claude@…>,Bug,Template system,1.6
21415,Unicode escapes appear verbatim in translated naturaltime strings,closed,claudep,Bug,Translations,1.6
21413,"select_related ""row, fields misalignment"" in SQLCompiler.fill_related_selections()",closed,nobody,Bug,"Database layer (models, ORM)",master
21412,Django message framework called with None,closed,syphar,Bug,contrib.messages,1.6
21411,CommandError: One or more models did not validate but backtrace not saying anything useful,closed,nobody,Bug,Documentation,1.6
21410,"Error when trying to ignore reverse relationships with related_name using the ""+""",closed,loic84,Bug,"Database layer (models, ORM)",1.6
21409,Incorrect default BASE_DIR value in project template,closed,nobody,Bug,Uncategorized,1.6
21408,Fallback to timesince produces erroneous translations in naturaltime,new,nobody,Bug,Internationalization,master
21406,blocktrans trimmed mixes up po-file source line numbers,closed,bouke,Bug,Internationalization,master
21405,Regression in ability to override queryset on BaseModelAdmin.formfield_for_foreignkey,closed,claudep,Bug,contrib.admin,1.6
21403,regression test fails on Oracle,closed,shai,Bug,"Database layer (models, ORM)",master
21402,Wrong Czech translation in EmailField validator,closed,nobody,Bug,Translations,1.6
21401,Bug when saving an object pointed by another,closed,nobody,Bug,"Database layer (models, ORM)",1.5
21400,The downloadable documentation displays the wrong version,closed,nobody,Bug,*.djangoproject.com,master
21398,Fix py-bcrypt compatibility on Python 3,closed,nobody,Bug,Python 3,1.6
21397,forms.TypedChoiceField validation problem,closed,claudep,Bug,Forms,1.6
21396,Backwards-incompatible change in RedirectView.get_redirect_url,closed,nobody,Bug,Documentation,1.6
21395,Admin widget JS files currently make <img> paths using admin_static_prefix,closed,nobody,Bug,contrib.admin,master
21394,Django 1.6 offline docs are actually 1.5.4,closed,nobody,Bug,Documentation,1.6
21390,Custom Manager Documentation Error,closed,nobody,Bug,Documentation,1.5
21389,Some languages not accepted as valid HTTP Accept-Language,closed,bouke,Bug,Internationalization,master
21388,Language code is incorrect for Frisian,closed,bouke,Bug,Internationalization,master
